animal,I tire of this one I mean I tire of this one all these animal let do this one tell me what this one be about,1,['1646']animal,the animal they all go away,1,['2359']animal,what be all these animal name,1,['23418']animal,animal can smell thing that you can smell sometimes they can tell where man and other animal be watch a dog sniff in the wind,1,['23877']animal,now let put all the animal here,1,['23492']animal,okay to make sure that it be not a poisonous snake she go to the zoo they identify it as a boa constrictor so she call her animal Cricter,1,['9256']animal,do it have animal in it,1,['19943']animal,like what animal,1,['17330']animal,look at all these animal what do they have with them,1,['5455']animal,okay but first you have_to decide where you want all the animal to be around the table and then you hafta put them there,1,['23397']animal,another what another animal,1,['17736']animal,that why there all these jungle animal look at all these little kid in this bus they not sit down in their seat they all stand up do you know who this be,1,['5623']animal,what kind of animal be that,1,['4926']animal,oh I say you hafta put all these animal up next_to the table,1,['23659']animal,which animal,1,['17314']animal,first let get all the animal around the table okay,1,['23335']animal,and a_lot_of the animal do have any water to drink,1,['12379']clothes,he tell Nurse Nelly he be go to put on his operate clothes,1,['16976']clothes,have some clothes,1,['21872']clothes,those be call clothes,1,['13173']clothes,to iron the clothes with,1,['4670']clothes,so let me put a diaper on my shoulder so I can take Ana so all my clothes will be spit up on hi,1,['8505']clothes,there be clothes in his umbrella that can make Dudley look like anything,1,['8727']clothes,yeah those be my clothes right,1,['5265']clothes,clothes on the vacuum clean,1,['16678']clothes,where do you put clothes,1,['1926']clothes,the king be in his count house count out his money the queen be in the parlor eat bread and honey the maid be in the garden hang out the clothes there come a little and snip off her nose,1,['24081']clothes,see there some more of them these be all my clothes,1,['5280']clothes,this be another clothes see it just like this shirt,1,['5300']clothes,you hit person with the clothes,1,['202']clothes,sometimes I a little lady and put on long clothes big shoe with high heel I walk on my toe,1,['6449']clothes,well no I wanna keep my clothes on,1,['7395']clothes,yeah that another clown that a clown get dress see put on the clothes there she put on the shoe,1,['2131']clothes,here maybe we should give mommy these clothes,1,['1914']clothes,where do you put the dirt clothes,1,['1942']clothes,clothes,1,['5627']clothes,do mother goat buy fun clothes wear overcoat tugboat,1,['13133']clothes,most person like to keep their clothes on in fact mommy do too but when they have_to feed their baby they have no choice,1,['7424']clothes,hang up the clothes,1,['2176']clothes,okay let go look for it you already have all your clothes on so we do have_to get dress right,1,['1864']clothes,Shem that the dirt clothes,1,['13641']clothes,yeah big boy wear those kind of clothes these be long pant and jacket like daddy daddy wear them too,1,['13230']clothes,why be the clothes blow by,1,['23151']clothes,here you can carry them Shem we can ask mommy where we should put the clothes,1,['2024']clothes,no put the clothes back in the dirt clothes Shem,1,['13719']clothes,my little brother use to do this when he be two he always want me to take my clothes off,1,['7223']clothes,now you can button it you do have any button on your clothes wanna see the dog,1,['3368']clothes,you be get to mow the rug with the clothes basket,1,['13946']clothes,you wanna put your dirty clothes away,1,['1956']clothes,do you keep them on the clothes,1,['58']food,why do she have food on her hat,1,['24213']food,it a toy apple it a fake apple so she not steal any real food,2,"['5737', '5737']"food,look it it have food on it,1,['16977']food,where the food for dinner,1,['21313']food,oh that what I mean that what I think it be call the co_op that the the place where you get your food the grocery place,1,['21742']food,it look like a little rabbit food,1,['12539']food,what kind of food be we gonna have,1,['21234']food,first they buy food to eat and clothes to wear,2,"['16619', '16619']"food,you buy food,2,"['573', '6437']"food,she smile it because she get food,1,['4009']food,cat eat food,1,['2140']food,do you think he buy food,1,['7956']food,poor little kitty have enough food in there,1,['10747']food,look at this food,1,['13890']food,grocer cat will sell the food to other person in busy town,1,['16304']food,yes mm they eat food slide down the hill,1,['6444']food,Dudley rush there but the bunny lady do have Sam_potatoes mother bunny be say to grocer dog I have decide not to buy any food today after all,1,['6415']food,that how they get their food,1,['16618']food,farm alfalfa grow all kind of food,1,['16223']food,the man have food,1,['2516']food,food,1,['24209']food,it the thing that you put food in,1,['6983']food,where do she have food,1,['24211']food,food what kind,1,['5612']food,okay that open the door and there food inside right,1,['1477']food,she want food and milk huh,1,['9578']food,this deaf cat be eat the other cat food,1,['4836']food,we work hard so there will be enough food and house and clothing for our family,1,['13646']furniture,that where they make furniture,1,['15791']furniture,they way down at the bottom underneath all that furniture,1,['20758']furniture,I like your new furniture arrangement,1,['5293']furniture,come back and get the furniture too after,1,['1002']furniture,because he at the furniture make store,1,['15768']furniture,but first let put the furniture on,1,['20363']furniture,all the piece of furniture too,1,['15579']furniture,how shall we load the furniture in okay,1,['23184']furniture,that because you roll on the furniture on those little mommy and daddy bed you just roll over on a mommy and daddy bed,1,['1825']furniture,or the same furniture but they just move it from their old house to their new house right,1,['20275']furniture,be you gonna have move man to help them load the furniture,1,['20860']furniture,we just need furniture right,1,['20434']furniture,Okay so should we have them all put in the new furniture,1,['20257']furniture,okay and then we can load up all of their furniture,1,['20337']furniture,that a mountain of furniture,1,['20825']toy,oh so you climb on it up on top of all the toy to get up here,1,['19496']toy,oh you get lots_of tinker toy,1,['12639']toy,yep you can see all your toy here now which one do you wanna play with,1,['22548']toy,I can hold the toy ship and a little toy man,1,['14151']toy,mm that a nice sound what can you do with this toy,1,['1135']toy,be this a new toy,1,['18173']toy,and a little toy ship and some milk on a dish,1,['13919']toy,nice to go over to Hilary house because you can try out all the new toy that there be,1,['17410']toy,Shem do you have any toy you want to play with,1,['368']toy,what kind of toy do he have,1,['8330']toy,it actual it call a office toy,1,['17038']toy,when do you play with your toy and read a book,1,['11690']toy,right but this be just a toy airplane so it will go very far,1,['8594']toy,here you want your toy honey,1,['7865']toy,Shem come in and say I like my toy outside so I can play with them,1,['9208']toy,okay then we put the toy in here,1,['3243']toy,here your toy here,1,['7964']toy,a toy house,1,['22485']toy,be that tie onto that toy though,1,['23027']toy,be they toy,1,['12628']toy,that my toy,1,['35']toy,you sink our toy ship,1,['14566']toy,and these toy airplane will go that far see,1,['8662']toy,you share toy with him,1,['8299']toy,but it too little to drive it just a toy car,1,['8738']toy,do he have good toy,1,['8318']toy,you play with toy so you do like to have your pajamas on,1,['12719']toy,you help him move his toy,1,['22071']toy,that their toy,1,['23918']toy,toy,1,['393']toy,he have toy,1,['8579']