,,,Column1,Codeanimal,the animal they all go away,1,,all Xanimal,now let put all the animal here,1,['2359'],animal,which animal,1,['23492'],which Xanimal,I tire of this one I mean I tire of this one all these animal let do this one tell me what this one be about,1,['17314'],animal,animal can smell thing that you can smell sometimes they can tell where man and other animal be watch a dog sniff in the wind,1,['1646'],animal,like what animal,1,['23877'],what Xanimal,another what another animal,1,['17330'],another Xanimal,oh I say you hafta put all these animal up next_to the table,1,['17736'],animal,first let get all the animal around the table okay,1,['23659'],animal,what kind of animal be that,1,['23335'],kind of Xanimal,and a_lot_of the animal do have any water to drink,1,['4926'],lot of the Xanimal,look at all these animal what do they have with them,1,['12379'],animal,okay but first you have_to decide where you want all the animal to be around the table and then you hafta put them there,1,['5455'],animal,do it have animal in it,1,['23397'],animal,that why there all these jungle animal look at all these little kid in this bus they not sit down in their seat they all stand up do you know who this be,1,['19943'],animal,okay to make sure that it be not a poisonous snake she go to the zoo they identify it as a boa constrictor so she call her animal Cricter,1,['5623'],animal,what be all these animal name,1,['9256'],clothes,see there some more of them these be all my clothes,1,['23418'],clothes,here maybe we should give mommy these clothes,1,['5280'],clothes,those be call clothes,1,['1914'],called Xclothes,hang up the clothes,1,['13173'],clothes,there be clothes in his umbrella that can make Dudley look like anything,1,['2176'],clothes,why be the clothes blow by,1,['8727'],clothes,most person like to keep their clothes on in fact mommy do too but when they have_to feed their baby they have no choice,1,['23151'],clothes,here you can carry them Shem we can ask mommy where we should put the clothes,1,['7424'],clothes,sometimes I a little lady and put on long clothes big shoe with high heel I walk on my toe,1,['2024'],clothes,no put the clothes back in the dirt clothes Shem,1,['6449'],clothes,you wanna put your dirty clothes away,1,['13719'],clothes,where do you put the dirt clothes,1,['1956'],clothes,do mother goat buy fun clothes wear overcoat tugboat,1,['1942'],clothes,to iron the clothes with,1,['13133'],clothes,you hit person with the clothes,1,['4670'],clothes,Shem that the dirt clothes,1,['202'],clothes,yeah big boy wear those kind of clothes these be long pant and jacket like daddy daddy wear them too,1,['13641'],"kind of X, these be Y"clothes,yeah those be my clothes right,1,['13230'],clothes,where do you put clothes,1,['5265'],clothes,now you can button it you do have any button on your clothes wanna see the dog,1,['1926'],clothes,my little brother use to do this when he be two he always want me to take my clothes off,1,['3368'],clothes,you be get to mow the rug with the clothes basket,1,['7223'],clothes,clothes,1,['13946'],clothes,well no I wanna keep my clothes on,1,['5627'],clothes,have some clothes,1,['7395'],clothes,clothes on the vacuum clean,1,['21872'],clothes,the king be in his count house count out his money the queen be in the parlor eat bread and honey the maid be in the garden hang out the clothes there come a little and snip off her nose,1,['16678'],clothes,this be another clothes see it just like this shirt,1,['24081'],clothes,okay let go look for it you already have all your clothes on so we do have_to get dress right,1,['5300'],all Xclothes,he tell Nurse Nelly he be go to put on his operate clothes,1,['1864'],clothes,yeah that another clown that a clown get dress see put on the clothes there she put on the shoe,1,['16976'],clothes,so let me put a diaper on my shoulder so I can take Ana so all my clothes will be spit up on hi,1,['2131'],clothes,do you keep them on the clothes,1,['8505'],food,where do she have food,1,['58'],food,poor little kitty have enough food in there,1,['24211'],food,grocer cat will sell the food to other person in busy town,1,['10747'],food,first they buy food to eat and clothes to wear,2,['16304'],food,it the thing that you put food in,1,"['16619', '16619']",food,this deaf cat be eat the other cat food,1,['6983'],food,yes mm they eat food slide down the hill,1,['4836'],food,she want food and milk huh,1,['6444'],food,that how they get their food,1,['9578'],food,do you think he buy food,1,['16618'],food,you buy food,2,['7956'],food,okay that open the door and there food inside right,1,"['573', '6437']",food,oh that what I mean that what I think it be call the co_op that the the place where you get your food the grocery place,1,['1477'],food,look it it have food on it,1,['21742'],food,food what kind,1,['16977'],what kind Xfood,food,1,['5612'],food,where the food for dinner,1,['24209'],food,it look like a little rabbit food,1,['21313'],food,farm alfalfa grow all kind of food,1,['12539'],food,what kind of food be we gonna have,1,['16223'],food,why do she have food on her hat,1,['21234'],food,we work hard so there will be enough food and house and clothing for our family,1,['24213'],food,the man have food,1,['13646'],food,Dudley rush there but the bunny lady do have Sam_potatoes mother bunny be say to grocer dog I have decide not to buy any food today after all,1,['2516'],food,cat eat food,1,['6415'],food,it a toy apple it a fake apple so she not steal any real food,2,['2140'],food,she smile it because she get food,1,"['5737', '5737']",food,look at this food,1,['4009'],toy,Shem come in and say I like my toy outside so I can play with them,1,['13890'],toy,he have toy,1,['9208'],toy,you help him move his toy,1,['8579'],toy,and these toy airplane will go that far see,1,['22071'],toy,do he have good toy,1,['8662'],toy,yep you can see all your toy here now which one do you wanna play with,1,['8318'],which onetoy,Shem do you have any toy you want to play with,1,['22548'],any Xtoy,you sink our toy ship,1,['368'],toy,toy,1,['14566'],toy,oh you get lots_of tinker toy,1,['393'],toy,right but this be just a toy airplane so it will go very far,1,['12639'],toy,but it too little to drive it just a toy car,1,['8594'],toy,that my toy,1,['8738'],toy,here you want your toy honey,1,['35'],toy,it actual it call a office toy,1,['7865'],call Xtoy,I can hold the toy ship and a little toy man,1,['17038'],toy,be this a new toy,1,['14151'],toy,oh so you climb on it up on top of all the toy to get up here,1,['18173'],all Xtoy,okay then we put the toy in here,1,['19496'],toy,that their toy,1,['3243'],toy,you play with toy so you do like to have your pajamas on,1,['23918'],toy,mm that a nice sound what can you do with this toy,1,['12719'],toy,and a little toy ship and some milk on a dish,1,['1135'],toy,be that tie onto that toy though,1,['13919'],toy,when do you play with your toy and read a book,1,['23027'],toy,you share toy with him,1,['11690'],toy,a toy house,1,['8299'],toy,what kind of toy do he have,1,['22485'],kind of Xtoy,be they toy,1,['8330'],toy,here your toy here,1,['12628'],toy,nice to go over to Hilary house because you can try out all the new toy that there be,1,['7964'],,,,['17410'],